{
  "id": "techpulse-youtube",
  "createdAt": "2024-01-01T00:00:00.000Z",
  "businessId": "techpulse",
  "platform": "youtube",
  "active": true,
  "handle": "@techpulse",
  "postsPerWeek": 2,
  "bestTimes": ["Wed 14:00", "Fri 10:00"],
  "primaryFormats": ["long-form-video", "short-form-video"],
  "followers": 0
}
