{
  "id": "acme-tiktok",
  "createdAt": "2024-01-01T00:00:00.000Z",
  "businessId": "acme-brand",
  "platform": "tiktok",
  "active": true,
  "handle": "@acmebrand",
  "postsPerWeek": 4,
  "bestTimes": ["Tue 11:00", "Thu 19:00", "Sat 10:00"],
  "primaryFormats": ["short-form-video", "duet", "stitch"],
  "followers": 0
}
