{
  "id": "acme-lemon8",
  "createdAt": "2024-01-01T00:00:00.000Z",
  "businessId": "acme-brand",
  "platform": "lemon8",
  "active": false,
  "handle": "@acmebrand",
  "postsPerWeek": 3,
  "bestTimes": ["Tue 10:00", "Thu 15:00"],
  "primaryFormats": ["mini-article", "tutorial", "list-post"],
  "followers": 0
}
