{
  "id": "acme-facebook",
  "createdAt": "2024-01-01T00:00:00.000Z",
  "businessId": "acme-brand",
  "platform": "facebook",
  "active": true,
  "handle": "Acme Brand",
  "postsPerWeek": 4,
  "bestTimes": ["Mon 9:00", "Wed 13:00", "Fri 11:00"],
  "primaryFormats": ["static-image", "carousel", "short-form-video"],
  "followers": 0
}
