{
  "id": "techpulse-linkedin",
  "createdAt": "2024-01-01T00:00:00.000Z",
  "businessId": "techpulse",
  "platform": "linkedin",
  "active": true,
  "handle": "TechPulse",
  "postsPerWeek": 4,
  "bestTimes": ["Tue 9:00", "Wed 11:00", "Thu 14:00"],
  "primaryFormats": ["text-post", "carousel", "article"],
  "followers": 0
}
